{
  "contract_id": "analytics-ui-observability-rollout-readiness",
  "contract_version": "0.1.0",
  "governed_by_rfc": "RFC-0108",
  "lifecycle_status": "slice-9-rollout-readiness-implemented",
  "source_proof": {
    "source_slice": "Slice 8",
    "canonical_portfolio": "PB_SG_GLOBAL_BAL_001",
    "canonical_benchmark": "BMK_PB_GLOBAL_BALANCED_60_40",
    "merge_commit": "9b5c2f7b675b1031d16351cf2d3a5672c3ee2168",
    "pull_request": "https://github.com/sgajbi/lotus-platform/pull/233",
    "evidence_artifacts": [
      "output/front-office-qa/canonical-front-office-qa-20260429-131616.json",
      "output/rfc-0108-slice-8-canonical/live-validation-summary.json",
      "output/rfc-0108-slice-8-canonical/SHOT-INDEX.md",
      "output/rfc-0108-slice-8-proof-review/latest.json"
    ]
  },
  "certified_route_groups": [
    {
      "route": "/book?asOfDate={canonicalAsOfDate}",
      "certification_status": "certified_partial",
      "panel_ids": ["advisor.book_overview"],
      "evidence_basis": "Workbench contract and browser-workflow tests validate the Gateway-backed advisor-book route, governed panel identity, screenshot ownership, and explicit authority states without substituting a global portfolio catalogue.",
      "residual_scope": "Canonical populated runtime proof remains required; delegated, team, and supervisor book coverage is not supported."
    },
    {
      "route": "/portfolio?portfolioId={portfolio_id}",
      "certification_status": "certified",
      "panel_ids": ["portfolio.summary"],
      "evidence_basis": "Slice 8 canonical proof validated the portfolio route after API and panel checks passed."
    },
    {
      "route": "/portfolio?portfolioId={portfolio_id}&tab=detailed",
      "certification_status": "certified",
      "panel_ids": ["portfolio.detailed"],
      "evidence_basis": "Slice 8 canonical proof validated the detailed portfolio route after API and panel checks passed."
    },
    {
      "route": "/reports?portfolioId={portfolio_id}",
      "certification_status": "certified_partial",
      "panel_ids": ["reporting.report_centre"],
      "evidence_basis": "Workbench contract and browser-workflow tests validate the Gateway-backed report-ordering route, governed panel identity, screenshot ownership, and explicit eligibility states without browser-authored catalogue choices.",
      "residual_scope": "Canonical populated runtime proof remains required; document rendering, archive, advisor approval, client delivery, and communication are not claimed."
    },
    {
      "route": "/performance?portfolioId={portfolio_id}",
      "certification_status": "certified",
      "panel_ids": ["performance.summary"],
      "evidence_basis": "Slice 8 canonical proof validated selected performance summary analytics state and metric exposure."
    },
    {
      "route": "/performance?portfolioId={portfolio_id}&mode=analysis",
      "certification_status": "certified_partial",
      "panel_ids": [
        "performance.analysis.contribution",
        "performance.analysis.attribution"
      ],
      "evidence_basis": "Canonical proof validates populated contribution and attribution panels against the Workbench panel registry without suppressing source-owned benchmark-relative qualifications.",
      "residual_scope": "Benchmark-relative attribution remains partial when classification coverage or residual materiality reason codes are present."
    },
    {
      "route": "/performance?portfolioId={portfolio_id}&mode=advisor",
      "certification_status": "certified",
      "panel_ids": ["performance.advisor_brief"],
      "evidence_basis": "Slice 8 canonical proof validated the advisor brief route after API and panel checks passed."
    },
    {
      "route": "/performance?portfolioId={portfolio_id}&mode=risk",
      "certification_status": "certified",
      "panel_ids": [
        "performance.risk.snapshot",
        "performance.risk.drawdown",
        "performance.risk.concentration",
        "performance.risk.rolling",
        "performance.risk.historical_attribution"
      ],
      "evidence_basis": "Slice 8 canonical proof validated selected risk panels against the Workbench panel registry."
    },
    {
      "route": "/performance?portfolioId={portfolio_id}&mode=evidence",
      "certification_status": "certified_partial",
      "panel_ids": ["performance.evidence"],
      "evidence_basis": "Slice 8 canonical proof validated truthful partial evidence state instead of overclaiming unsupported lineage behavior.",
      "residual_scope": "Full evidence and lineage behavior remains governed by RFC-0079."
    },
    {
      "route": "/workbench/{portfolio_id}",
      "certification_status": "certified",
      "panel_ids": [
        "dpm.command_center",
        "dpm.wave_command_center",
        "dpm.portfolio_memory",
        "dpm.outcome_review",
        "dpm.proof_pack"
      ],
      "evidence_basis": "RFC-0040/0041/0042 and RFC38 WTBD-003 Workbench proof validates the embedded DPM command-center cockpit, portfolio-memory timeline, rebalance-wave command center, proof-pack evidence panel, and post-trade outcome-review panel against live Gateway and lotus-manage contracts."
    },
    {
      "route": "/workbench/{portfolio_id}?mode=construction",
      "certification_status": "certified",
      "panel_ids": ["dpm.construction_alternatives"],
      "evidence_basis": "RFC37-WTBD-003 front-office closure proof validates the Gateway-backed construction alternatives route without local construction methodology, order-routing, trade-execution, or OMS claims."
    },
    {
      "route": "/workbench/{portfolio_id}?mode=quality",
      "certification_status": "certified",
      "panel_ids": ["dpm.pm_operating_quality"],
      "evidence_basis": "RFC37-WTBD-003 front-office closure proof validates the Gateway/manage PM operating-quality route with score-run, fairness, policy, authority, and summary-invocation posture, without PM ranking, HR, client-contact, or execution claims."
    },
    {
      "route": "/workbench/{portfolio_id}?mode=copilot",
      "certification_status": "certified",
      "panel_ids": ["dpm.copilot_workspace"],
      "evidence_basis": "RFC37-WTBD-003 front-office closure proof validates the bounded Gateway/lotus-ai PM copilot workspace route without prompt storage, generated-response storage, client-contact, order-routing, or OMS claims."
    },
    {
      "route": "/proposals/{proposalId}",
      "certification_status": "certified",
      "panel_ids": ["proposal.narrative_posture", "proposal.memo_evidence_pack"],
      "evidence_basis": "RFC-0023 Slice 12 and RFC-0024 adjacent canonical proof validate the Gateway-backed advisor-use proposal narrative posture and memo evidence-pack panels without promoting client-ready release, document rendering, or client communication scope."
    },
    {
      "route": "/recommendations?portfolioId={portfolio_id}&mode=cockpit",
      "certification_status": "certified",
      "panel_ids": ["advisory.advisor_cockpit"],
      "evidence_basis": "RFC-0026 canonical proof validates the Gateway-backed advisor cockpit action list, operating snapshot, meeting-preparation packets, supportability posture, and idempotent acknowledgement without promoting client-ready release, client communication, order generation, or OMS execution."
    },
    {
      "route": "/recommendations?portfolioId={portfolio_id}&mode=copilot",
      "certification_status": "certified",
      "panel_ids": ["advisory.advisory_copilot"],
      "evidence_basis": "RFC-0027 canonical proof validates the Gateway-backed advisory copilot action and evidence-packet route with explicit review-required posture, idempotency protection, and blocked client-ready publication, autonomous advice, client communication, order generation, OMS execution, fill, and settlement scope."
    },
    {
      "route": "/recommendations?portfolioId={portfolio_id}&mode=proof",
      "certification_status": "certified",
      "panel_ids": ["advisory.bank_demo_proof"],
      "evidence_basis": "RFC-0028 Slice 8 canonical proof validates the Gateway-backed bank demo proof surface, supported-claim register, scenario steps, source-owned classifications, and blocked client-publication boundary without promoting external client communication, order generation, OMS execution, fill, or settlement scope."
    }
  ],
  "rollout_checklist": [
    {
      "step": "Register the target route and panels in the Workbench panel registry before claiming observability support.",
      "required_evidence": "Panel ids, routes, owning services, allowed states, screenshot policy, and known limitations are source-controlled."
    },
    {
      "step": "Add code-owned Workbench and Gateway telemetry vocabulary before emitting events.",
      "required_evidence": "Vocabulary tests reject unknown labels and sensitive fields."
    },
    {
      "step": "Emit only bounded metrics, logs, attention events, or audit events backed by implemented code.",
      "required_evidence": "Runtime tests cover emitted names, labels, states, reason codes, and field exclusion."
    },
    {
      "step": "Add dashboard and alert references only for implemented metric families.",
      "required_evidence": "Contract and platform-stack tests reject unimplemented metric references."
    },
    {
      "step": "Run canonical or route-specific browser proof after API, calculation, and panel validation pass.",
      "required_evidence": "Proof records route, panel ids, commit SHA, command, screenshot index, API checks, calculation checks, and panel classifications."
    },
    {
      "step": "Run sensitive-content assertions over generated evidence artifacts.",
      "required_evidence": "Assertions cover logs, metrics, dashboard/alert evidence, screenshot indexes, and proof summaries without allowing client, holding, request, response, trace, or correlation content."
    },
    {